id,date_publication,titre,entreprise,ville,type_contrat,secteur,niveau_requis,competences,salaire,teletravail,experience_requise_ans,mois,trimestre,categorie,est_stage
1419,2024-02-13,Business Intelligence Analyst,Contentsquare,Paris,Stage,FinTech,Bac+3,"Scikit-learn, API REST, Git, TensorFlow, AWS, Tableau",1175.0,Oui,1,2024-02,2024Q1,Data Analysis,True
1420,2024-02-13,NLP Engineer,PhotoRoom,Paris,Stage,RetailTech,Bac+4,"Tableau, dbt, Python, Power BI",1027.0,Hybride,0,2024-02,2024Q1,Data Engineering,True
1421,2023-10-29,Data Engineer,Shift Technology,Paris,CDI,EdTech,Bac+4,"Python, Tableau, NLP",71593.0,Non,0,2023-10,2023Q4,Data Engineering,False
1422,2024-01-02,Data Scientist,Ekimetrics,Bordeaux,CDI,SaaS,Bac+8 (PhD),"Tableau, PyTorch, Docker, LLM, Airflow, Spark",55025.0,Hybride,5,2024-01,2024Q1,Data Science,False
1423,2023-08-20,Computer Vision Engineer,Hugging Face,Lyon,CDI,HealthTech,Bac+4,"Power BI, PyTorch, NLP, AWS, SQL, dbt",44315.0,Non,5,2023-08,2023Q3,Data Engineering,False
1424,2024-06-16,Computer Vision Engineer,Qonto,Paris,Stage,FinTech,Bac+4,"Docker, TensorFlow, Spark, Computer Vision, NLP, Pandas, Power BI",1053.0,Non,5,2024-06,2024Q2,Data Engineering,True
1425,2024-01-05,ML Engineer,Mirakl,Paris,CDI,HealthTech,Bac+4,"Azure, Docker, AWS, Hugging Face, Power BI",74364.0,Hybride,0,2024-01,2024Q1,ML Engineering,False
1426,2024-04-04,MLOps Engineer,Doctolib,Paris,CDI,SaaS,Bac+4,"Kubernetes, Git, dbt, GCP, TensorFlow",57584.0,Oui,0,2024-04,2024Q2,ML Engineering,False
1427,2024-05-26,Computer Vision Engineer,Younited,Paris,Freelance,MarTech,Bac+4,"Power BI, Spark, Pandas, Kubernetes, GCP",758.0,Hybride,2,2024-05,2024Q2,Data Engineering,False
1429,2023-08-01,Stagiaire Data Science,Mirakl,Lille,CDI,MarTech,Bac+4,"Python, Kubernetes, Computer Vision, Deep Learning, Tableau, TensorFlow",62073.0,Oui,3,2023-08,2023Q3,Stage,False
1430,2024-01-20,Computer Vision Engineer,Ekimetrics,Paris,CDI,EdTech,Bac+4,"Hugging Face, Git, Airflow, Machine Learning, Scikit-learn, Tableau",38721.0,Hybride,0,2024-01,2024Q1,Data Engineering,False
1431,2023-11-19,Business Intelligence Analyst,Mistral AI,Paris,CDI,MarTech,Bac+4,"NLP, Spark, Azure",66823.0,Non,3,2023-11,2023Q4,Data Analysis,False
1432,2023-10-06,Computer Vision Engineer,Ekimetrics,Lyon,CDI,LegalTech,Bac+3,"TensorFlow, Airflow, Kubernetes, NLP, GCP, Hugging Face, LLM",42887.0,Hybride,3,2023-10,2023Q4,Data Engineering,False
1433,2023-09-01,Data Analyst,Younited,Grenoble,CDI,DeepTech,Bac+5,"Git, SQL, Pandas, Computer Vision, Docker",67859.0,Non,5,2023-09,2023Q3,Data Analysis,False
1434,2024-02-18,Data Scientist,Mistral AI,Paris,Stage,DeepTech,Bac+5,"Airflow, Pandas, TensorFlow, Docker, Python",1006.0,Oui,1,2024-02,2024Q1,Data Science,True
1435,2023-08-16,Computer Vision Engineer,PhotoRoom,Paris,Stage,SaaS,Bac+5,"Scikit-learn, Azure, Tableau, LLM",623.0,Non,0,2023-08,2023Q3,Data Engineering,True
1436,2024-06-04,AI Researcher,PhotoRoom,Paris,CDD,RetailTech,Bac+8 (PhD),"Airflow, Pandas, GCP, Hugging Face, Scikit-learn, Docker",84134.0,Non,0,2024-06,2024Q2,Recherche IA,False
1437,2023-10-17,Data Analyst,Doctolib,Lyon,CDI,RetailTech,Bac+8 (PhD),"Kubernetes, LLM, NLP",61972.0,Non,5,2023-10,2023Q4,Data Analysis,False
1438,2024-05-24,NLP Engineer,BlaBlaCar,Lyon,Alternance,FinTech,Bac+5,"Python, Azure, Power BI, Git, Kubernetes, Tableau, PyTorch",1195.0,Hybride,1,2024-05,2024Q2,Data Engineering,False
1439,2024-05-23,Business Intelligence Analyst,Owkin,Toulouse,CDI,HealthTech,Bac+5,"API REST, RAG, SQL, Computer Vision, GCP, TensorFlow, NLP",71408.0,Oui,0,2024-05,2024Q2,Data Analysis,False
1440,2024-05-01,Data Analyst,Owkin,Paris,Stage,DeepTech,Bac+4,"PyTorch, GCP, Spark, Machine Learning, dbt, Azure, Kubernetes",863.0,Non,0,2024-05,2024Q2,Data Analysis,True
1441,2023-07-11,Computer Vision Engineer,Shift Technology,Lille,Stage,E-commerce,Bac+4,"LLM, SQL, Computer Vision, Power BI, Azure, Tableau",1164.0,Oui,0,2023-07,2023Q3,Data Engineering,True
1442,2023-07-26,Computer Vision Engineer,Younited,Bordeaux,CDD,FinTech,Bac+3,"Deep Learning, API REST, Airflow, Spark",45113.0,Hybride,5,2023-07,2023Q3,Data Engineering,False
1443,2023-12-18,MLOps Engineer,Younited,Grenoble,CDI,SaaS,Bac+5,"SQL, Azure, GCP",60327.0,Oui,0,2023-12,2023Q4,ML Engineering,False
1444,2023-11-02,Data Engineer,Alan,Lyon,CDI,FinTech,Bac+5,"TensorFlow, Computer Vision, Kubernetes, Tableau",36125.0,Hybride,1,2023-11,2023Q4,Data Engineering,False
1445,2023-09-03,Computer Vision Engineer,Back Market,Paris,Stage,HealthTech,Bac+4,"AWS, GCP, Power BI",1094.0,Oui,0,2023-09,2023Q3,Data Engineering,True
1446,2024-04-15,Stagiaire Data Science,Qonto,Paris,Stage,FinTech,Bac+4,"Pandas, Spark, RAG",958.0,Non,5,2024-04,2024Q2,Stage,True
1447,2023-10-14,Data Analyst,Mistral AI,Grenoble,CDI,EdTech,Bac+5,"dbt, Computer Vision, PyTorch, Tableau, Pandas, TensorFlow, LLM",45785.0,Non,3,2023-10,2023Q4,Data Analysis,False
1448,2023-08-05,Business Intelligence Analyst,BlaBlaCar,Paris,Alternance,EdTech,Bac+5,"Tableau, PyTorch, Pandas, Hugging Face, Airflow, Kubernetes, GCP",1212.0,Non,0,2023-08,2023Q3,Data Analysis,False
1449,2024-04-09,Stagiaire Data Analyst,Payfit,Grenoble,Alternance,DeepTech,Bac+5,"Scikit-learn, Python, Hugging Face, Azure, AWS",1402.0,Oui,0,2024-04,2024Q2,Data Analysis,False
1450,2023-10-15,Data Analyst,Ekimetrics,Marseille,CDI,LegalTech,Bac+4,"Tableau, Deep Learning, Git",73574.0,Hybride,5,2023-10,2023Q4,Data Analysis,False
1451,2024-04-26,Stagiaire ML,Doctolib,Paris,CDI,SaaS,Bac+5,"GCP, AWS, Pandas, RAG, Docker",45869.0,Oui,5,2024-04,2024Q2,Stage,False
1452,2023-10-19,Stagiaire Data Analyst,Mistral AI,Paris,CDI,EdTech,Bac+8 (PhD),"RAG, Airflow, Pandas, Computer Vision",48689.0,Oui,0,2023-10,2023Q4,Data Analysis,False
1453,2023-10-28,ML Engineer,Swile,Paris,Stage,DeepTech,Bac+8 (PhD),"Pandas, NLP, Git, Tableau, Kubernetes",700.0,Hybride,0,2023-10,2023Q4,ML Engineering,True
1454,2023-12-16,Computer Vision Engineer,Mirakl,Paris,CDD,HealthTech,Bac+3,"LLM, Hugging Face, Docker, AWS, Spark, Machine Learning",37803.0,Oui,0,2023-12,2023Q4,Data Engineering,False
1455,2023-09-14,Stagiaire Data Science,Swile,Paris,CDI,DeepTech,Bac+5,"Python, Airflow, Docker",72151.0,Hybride,3,2023-09,2023Q3,Stage,False
1456,2024-05-01,ML Engineer,Ekimetrics,Paris,CDD,DeepTech,Bac+5,"SQL, dbt, Pandas",63343.0,Hybride,1,2024-05,2024Q2,ML Engineering,False
1457,2023-07-02,Data Analyst,Dataiku,Paris,CDI,HealthTech,Bac+3,"Power BI, Azure, Python, Docker, API REST",60492.0,Non,0,2023-07,2023Q3,Data Analysis,False
1458,2023-11-19,AI Researcher,PhotoRoom,Paris,CDI,FinTech,Bac+5,"Pandas, Deep Learning, Azure, AWS, Python, NLP",89868.0,Oui,0,2023-11,2023Q4,Recherche IA,False
1459,2023-09-13,Stagiaire ML,Kayrros,Paris,Stage,EdTech,Bac+5,"Scikit-learn, RAG, GCP, LLM",1078.0,Oui,5,2023-09,2023Q3,Stage,True
1460,2023-09-05,Stagiaire Data Science,Alan,Paris,CDD,DeepTech,Bac+5,"Machine Learning, Git, GCP, TensorFlow, Pandas, API REST",59172.0,Oui,0,2023-09,2023Q3,Stage,False
1461,2024-04-02,Computer Vision Engineer,Owkin,Paris,CDI,EdTech,Bac+3,"Scikit-learn, Power BI, PyTorch, Python, RAG, SQL",38742.0,Hybride,1,2024-04,2024Q2,Data Engineering,False
1462,2023-11-06,Stagiaire ML,Younited,Paris,CDD,SaaS,Bac+5,"Pandas, Airflow, Python, AWS, Git, API REST",43460.0,Oui,5,2023-11,2023Q4,Stage,False
1463,2023-09-28,Data Scientist,Doctolib,Paris,CDI,HealthTech,Bac+8 (PhD),"Power BI, LLM, GCP, NLP, Spark, SQL, Docker",41500.0,Hybride,1,2023-09,2023Q3,Data Science,False
1464,2023-08-26,Computer Vision Engineer,Back Market,Nantes,CDD,RetailTech,Bac+5,"LLM, PyTorch, dbt, AWS, GCP, API REST",51271.0,Non,5,2023-08,2023Q3,Data Engineering,False
1465,2024-06-03,Stagiaire Data Analyst,Swile,Paris,CDI,MarTech,Bac+5,"Power BI, PyTorch, RAG, Tableau, dbt",35799.0,Non,0,2024-06,2024Q2,Data Analysis,False
1466,2023-07-14,Stagiaire Data Analyst,Mirakl,Paris,CDI,EdTech,Bac+5,"AWS, LLM, Power BI, dbt, GCP, Machine Learning",35299.0,Oui,1,2023-07,2023Q3,Data Analysis,False
1467,2023-09-06,Business Intelligence Analyst,Payfit,Paris,Stage,RetailTech,Bac+4,"Scikit-learn, LLM, AWS, PyTorch, SQL, Kubernetes",1039.0,Hybride,1,2023-09,2023Q3,Data Analysis,True
1468,2023-07-08,MLOps Engineer,Alan,Paris,Stage,HealthTech,Bac+4,"RAG, TensorFlow, Pandas, GCP",726.0,Non,0,2023-07,2023Q3,ML Engineering,True
1469,2023-12-31,MLOps Engineer,PhotoRoom,Toulouse,Stage,LegalTech,Bac+4,"SQL, Computer Vision, Deep Learning, RAG, Python, Airflow, LLM",849.0,Hybride,5,2023-12,2023Q4,ML Engineering,True
1470,2023-10-30,Business Intelligence Analyst,Alan,Lyon,CDD,LegalTech,Bac+5,"Deep Learning, Kubernetes, dbt, LLM, Tableau, Computer Vision",52923.0,Hybride,1,2023-10,2023Q4,Data Analysis,False
1471,2024-04-27,Stagiaire ML,Shift Technology,Lyon,CDI,LegalTech,Bac+8 (PhD),"GCP, Deep Learning, Spark, Azure, AWS, Scikit-learn",49350.0,Hybride,0,2024-04,2024Q2,Stage,False
1472,2023-12-13,MLOps Engineer,Withings,Paris,CDI,LegalTech,Bac+8 (PhD),"NLP, TensorFlow, Machine Learning",57634.0,Non,1,2023-12,2023Q4,ML Engineering,False
1473,2023-07-09,Data Engineer,Hugging Face,Paris,Stage,LegalTech,Bac+5,"Azure, Deep Learning, Pandas, Python, AWS, API REST, Docker",1031.0,Oui,5,2023-07,2023Q3,Data Engineering,True
1474,2023-09-28,Data Analyst,Contentsquare,Paris,CDI,MarTech,Bac+4,"Airflow, Scikit-learn, Deep Learning",53557.0,Hybride,2,2023-09,2023Q3,Data Analysis,False
1476,2023-07-27,Stagiaire Data Science,Qonto,Paris,Stage,MarTech,Bac+5,"AWS, NLP, SQL",678.0,Non,0,2023-07,2023Q3,Stage,True
1477,2023-09-03,AI Researcher,Doctolib,Lyon,CDI,SaaS,Bac+5,"Tableau, LLM, Deep Learning, Power BI, RAG, Hugging Face",70641.0,Oui,2,2023-09,2023Q3,Recherche IA,False
1478,2024-02-01,Data Scientist,Owkin,Paris,CDI,LegalTech,Bac+8 (PhD),"API REST, Machine Learning, NLP, Airflow, LLM, Git",51253.0,Hybride,5,2024-02,2024Q1,Data Science,False
1479,2024-03-26,Stagiaire Data Analyst,BlaBlaCar,Paris,Stage,LegalTech,Bac+3,"Scikit-learn, Tableau, Git",910.0,Hybride,2,2024-03,2024Q1,Data Analysis,True
1480,2023-08-28,Data Scientist,Ekimetrics,Lyon,Alternance,DeepTech,Bac+5,"Docker, LLM, API REST, GCP, Scikit-learn",1228.0,Oui,0,2023-08,2023Q3,Data Science,False
1481,2023-08-02,Stagiaire Data Analyst,Payfit,Marseille,CDI,SaaS,Bac+5,"RAG, AWS, API REST, Python",41991.0,Oui,3,2023-08,2023Q3,Data Analysis,False
1482,2024-02-29,ML Engineer,Kayrros,Lyon,CDI,HealthTech,Bac+5,"Airflow, GCP, RAG, Tableau, LLM, SQL",66073.0,Hybride,3,2024-02,2024Q1,ML Engineering,False
1483,2024-02-15,Computer Vision Engineer,Withings,Grenoble,Stage,MarTech,Bac+5,"Scikit-learn, Docker, PyTorch, SQL",647.0,Non,0,2024-02,2024Q1,Data Engineering,True
1484,2024-01-02,Stagiaire Data Analyst,Mistral AI,Rennes,CDI,DeepTech,Bac+5,"Machine Learning, Pandas, NLP, Spark",50576.0,Hybride,5,2024-01,2024Q1,Data Analysis,False
1485,2024-03-19,ML Engineer,Qonto,Paris,Stage,LegalTech,Bac+4,"SQL, Docker, PyTorch, Spark, Kubernetes, RAG",743.0,Hybride,2,2024-03,2024Q1,ML Engineering,True
1486,2024-04-29,Stagiaire ML,Shift Technology,Paris,CDI,FinTech,Bac+5,"Deep Learning, PyTorch, TensorFlow",35786.0,Non,2,2024-04,2024Q2,Stage,False
1487,2023-08-25,Business Intelligence Analyst,Hugging Face,Paris,Alternance,DeepTech,Bac+3,"Python, GCP, Computer Vision, dbt, Azure, LLM",1271.0,Non,0,2023-08,2023Q3,Data Analysis,False
1488,2024-02-17,AI Researcher,Kayrros,Toulouse,Stage,MarTech,Bac+4,"LLM, GCP, Power BI, Machine Learning, AWS, Azure",688.0,Non,2,2024-02,2024Q1,Recherche IA,True
1489,2024-03-14,MLOps Engineer,Owkin,Paris,Stage,RetailTech,Bac+5,"TensorFlow, Deep Learning, Python, PyTorch",627.0,Hybride,0,2024-03,2024Q1,ML Engineering,True
1490,2023-10-22,Computer Vision Engineer,Contentsquare,Paris,CDI,HealthTech,Bac+5,"dbt, LLM, Airflow, NLP, Machine Learning, PyTorch, RAG",65789.0,Hybride,0,2023-10,2023Q4,Data Engineering,False
1491,2024-05-10,Data Engineer,Alan,Lille,CDI,FinTech,Bac+5,"TensorFlow, Docker, Git, GCP",51259.0,Non,0,2024-05,2024Q2,Data Engineering,False
1492,2023-07-23,MLOps Engineer,Kayrros,Grenoble,CDI,E-commerce,Bac+3,"Deep Learning, Computer Vision, AWS",71310.0,Oui,1,2023-07,2023Q3,ML Engineering,False
1493,2024-06-02,ML Engineer,PhotoRoom,Toulouse,Freelance,DeepTech,Bac+4,"Spark, NLP, Pandas, AWS, Deep Learning",717.0,Hybride,5,2024-06,2024Q2,ML Engineering,False
1494,2024-03-23,Stagiaire Data Analyst,Qonto,Nantes,Stage,E-commerce,Bac+8 (PhD),"Machine Learning, TensorFlow, AWS, Git, Computer Vision, GCP, API REST",773.0,Oui,3,2024-03,2024Q1,Data Analysis,True
1495,2023-12-02,ML Engineer,Younited,Paris,CDI,EdTech,Bac+5,"Azure, API REST, Power BI, dbt",56503.0,Non,0,2023-12,2023Q4,ML Engineering,False
1496,2024-02-20,NLP Engineer,Mistral AI,Paris,Stage,LegalTech,Bac+3,"Kubernetes, API REST, Tableau",1176.0,Hybride,5,2024-02,2024Q1,Data Engineering,True
1497,2024-05-25,Business Intelligence Analyst,Payfit,Paris,CDI,DeepTech,Bac+8 (PhD),"Scikit-learn, Hugging Face, Spark, TensorFlow, NLP, Git",57674.0,Hybride,5,2024-05,2024Q2,Data Analysis,False
1498,2023-07-16,ML Engineer,Owkin,Toulouse,Stage,DeepTech,Bac+5,"Hugging Face, Computer Vision, Docker, NLP",608.0,Hybride,0,2023-07,2023Q3,ML Engineering,True
1499,2023-08-01,NLP Engineer,Shift Technology,Paris,CDI,FinTech,Bac+5,"LLM, Machine Learning, GCP",37889.0,Non,1,2023-08,2023Q3,Data Engineering,False
1500,2024-03-02,NLP Engineer,Mirakl,Bordeaux,CDI,MarTech,Bac+4,"Scikit-learn, Azure, Kubernetes, Docker, LLM",54412.0,Non,2,2024-03,2024Q1,Data Engineering,False
1501,2024-01-22,MLOps Engineer,ManoMano,Paris,Stage,RetailTech,Bac+5,"Tableau, GCP, RAG, LLM, Hugging Face, Azure",1123.0,Non,1,2024-01,2024Q1,ML Engineering,True
1502,2024-02-04,Data Analyst,Kayrros,Marseille,CDI,EdTech,Bac+3,"Kubernetes, LLM, Computer Vision, Hugging Face, Azure, Machine Learning",55735.0,Non,1,2024-02,2024Q1,Data Analysis,False
1503,2024-06-16,Stagiaire Data Science,Withings,Paris,Stage,LegalTech,Bac+5,"Spark, Kubernetes, Git, API REST, RAG, Pandas, dbt",1082.0,Non,3,2024-06,2024Q2,Stage,True
1504,2023-08-25,Stagiaire Data Analyst,Shift Technology,Paris,Alternance,EdTech,Bac+5,"Airflow, API REST, Hugging Face, Power BI, Pandas, GCP",1364.0,Oui,5,2023-08,2023Q3,Data Analysis,False
1505,2024-03-08,Stagiaire Data Analyst,ManoMano,Paris,CDI,E-commerce,Bac+3,"GCP, LLM, Kubernetes, Pandas, Scikit-learn",56850.0,Oui,0,2024-03,2024Q1,Data Analysis,False
1506,2024-06-29,Stagiaire ML,PhotoRoom,Nantes,CDI,SaaS,Bac+3,"Azure, Spark, Pandas, Hugging Face, Kubernetes",69246.0,Non,0,2024-06,2024Q2,Stage,False
1507,2024-02-13,NLP Engineer,Shift Technology,Paris,CDI,EdTech,Bac+4,"GCP, Airflow, RAG, Scikit-learn, LLM, Kubernetes",69991.0,Hybride,0,2024-02,2024Q1,Data Engineering,False
1508,2023-08-07,AI Researcher,Owkin,Paris,Stage,LegalTech,Bac+5,"Tableau, LLM, Python",974.0,Non,2,2023-08,2023Q3,Recherche IA,True
1509,2023-08-11,Computer Vision Engineer,Dataiku,Paris,Stage,DeepTech,Bac+4,"RAG, Airflow, Computer Vision, API REST, Power BI, Pandas, Git",984.0,Hybride,2,2023-08,2023Q3,Data Engineering,True
1510,2023-12-12,Stagiaire Data Science,BlaBlaCar,Nantes,Stage,HealthTech,Bac+5,"NLP, Power BI, Tableau",676.0,Oui,0,2023-12,2023Q4,Stage,True
1511,2024-05-07,Data Analyst,Back Market,Paris,Stage,E-commerce,Bac+4,"API REST, SQL, Machine Learning, Airflow, Deep Learning",857.0,Non,0,2024-05,2024Q2,Data Analysis,True
1512,2023-09-14,Data Analyst,Hugging Face,Bordeaux,Stage,MarTech,Bac+5,"Pandas, SQL, AWS, RAG, Git, Python",663.0,Hybride,5,2023-09,2023Q3,Data Analysis,True
1513,2023-08-03,AI Researcher,Kayrros,Lille,Stage,E-commerce,Bac+8 (PhD),"Power BI, Spark, Hugging Face, RAG, API REST",908.0,Non,0,2023-08,2023Q3,Recherche IA,True
1514,2023-09-03,ML Engineer,Younited,Paris,CDI,RetailTech,Bac+5,"LLM, RAG, Kubernetes",68928.0,Non,0,2023-09,2023Q3,ML Engineering,False
1515,2023-11-18,MLOps Engineer,Hugging Face,Paris,CDI,HealthTech,Bac+5,"Python, PyTorch, Machine Learning, RAG, Hugging Face, Airflow, NLP",68871.0,Oui,2,2023-11,2023Q4,ML Engineering,False
1516,2024-05-15,Data Engineer,Kayrros,Paris,CDI,HealthTech,Bac+5,"Scikit-learn, Hugging Face, PyTorch, Spark",54677.0,Oui,0,2024-05,2024Q2,Data Engineering,False
1517,2024-05-20,Stagiaire Data Analyst,Ekimetrics,Toulouse,CDI,LegalTech,Bac+5,"Power BI, RAG, Hugging Face, Tableau, Scikit-learn",54459.0,Oui,0,2024-05,2024Q2,Data Analysis,False
1518,2024-04-25,NLP Engineer,Back Market,Paris,CDI,EdTech,Bac+4,"Scikit-learn, TensorFlow, Tableau, Hugging Face, GCP, Python",72971.0,Oui,5,2024-04,2024Q2,Data Engineering,False
1519,2024-04-06,Computer Vision Engineer,Mirakl,Paris,CDI,DeepTech,Bac+3,"Computer Vision, Kubernetes, Git, Python, NLP, API REST",47284.0,Non,3,2024-04,2024Q2,Data Engineering,False
1520,2024-06-29,Data Engineer,Alan,Paris,CDI,RetailTech,Bac+5,"TensorFlow, GCP, Machine Learning, Hugging Face, AWS",57068.0,Non,0,2024-06,2024Q2,Data Engineering,False
1521,2023-12-14,Data Engineer,Withings,Marseille,CDI,LegalTech,Bac+4,"dbt, Tableau, Airflow, Spark, GCP",50094.0,Non,3,2023-12,2023Q4,Data Engineering,False
1522,2024-01-12,Computer Vision Engineer,Owkin,Paris,CDI,SaaS,Bac+4,"AWS, RAG, Spark",65381.0,Hybride,0,2024-01,2024Q1,Data Engineering,False
1523,2024-05-01,NLP Engineer,Contentsquare,Paris,Stage,HealthTech,Bac+5,"dbt, API REST, Tableau, Python, NLP, Power BI, Scikit-learn",851.0,Non,1,2024-05,2024Q2,Data Engineering,True
1524,2024-03-28,Business Intelligence Analyst,PhotoRoom,Paris,CDI,LegalTech,Bac+5,"Airflow, dbt, NLP, PyTorch",43199.0,Hybride,5,2024-03,2024Q1,Data Analysis,False
1525,2023-11-28,MLOps Engineer,Owkin,Nantes,CDI,RetailTech,Bac+5,"Computer Vision, Pandas, SQL, Tableau, dbt, GCP, Spark",42928.0,Oui,3,2023-11,2023Q4,ML Engineering,False
1526,2024-02-18,Stagiaire ML,Withings,Bordeaux,CDI,RetailTech,Bac+8 (PhD),"SQL, Airflow, Machine Learning, Computer Vision, Git, Scikit-learn, TensorFlow",47769.0,Non,1,2024-02,2024Q1,Stage,False
1527,2024-03-15,ML Engineer,Owkin,Paris,CDI,LegalTech,Bac+3,"Power BI, Docker, PyTorch, Computer Vision",54721.0,Oui,3,2024-03,2024Q1,ML Engineering,False
1528,2024-05-05,Data Scientist,PhotoRoom,Lille,CDI,LegalTech,Bac+5,"Azure, Git, PyTorch, Docker, LLM, NLP, Power BI",74060.0,Oui,0,2024-05,2024Q2,Data Science,False
1530,2023-08-20,Computer Vision Engineer,Mistral AI,Rennes,Stage,MarTech,Bac+5,"API REST, dbt, PyTorch, TensorFlow, LLM, GCP, Spark",759.0,Oui,1,2023-08,2023Q3,Data Engineering,True
1531,2024-06-24,MLOps Engineer,Shift Technology,Paris,CDI,RetailTech,Bac+8 (PhD),"Computer Vision, SQL, Tableau",35157.0,Oui,2,2024-06,2024Q2,ML Engineering,False
1532,2023-08-28,ML Engineer,Kayrros,Toulouse,Stage,SaaS,Bac+4,"Spark, Hugging Face, dbt, RAG",906.0,Oui,2,2023-08,2023Q3,ML Engineering,True
1533,2024-05-31,ML Engineer,Mirakl,Paris,CDI,FinTech,Bac+5,"GCP, Spark, PyTorch",50039.0,Oui,2,2024-05,2024Q2,ML Engineering,False
1534,2024-05-29,ML Engineer,Qonto,Paris,CDI,DeepTech,Bac+4,"Docker, Scikit-learn, Computer Vision",35721.0,Hybride,3,2024-05,2024Q2,ML Engineering,False
1535,2024-04-08,Stagiaire ML,ManoMano,Lille,CDI,DeepTech,Bac+5,"Computer Vision, Scikit-learn, Azure, API REST, dbt, Hugging Face",60496.0,Non,3,2024-04,2024Q2,Stage,False
1536,2023-10-19,NLP Engineer,Ekimetrics,Paris,CDI,HealthTech,Bac+5,"Computer Vision, NLP, TensorFlow, SQL",39336.0,Hybride,1,2023-10,2023Q4,Data Engineering,False
1537,2024-02-06,AI Researcher,Alan,Paris,Stage,EdTech,Bac+5,"Hugging Face, Power BI, Tableau",907.0,Non,0,2024-02,2024Q1,Recherche IA,True
1538,2024-02-17,Business Intelligence Analyst,Swile,Lille,Stage,RetailTech,Bac+5,"Pandas, Python, API REST, Power BI, Azure, TensorFlow",948.0,Hybride,1,2024-02,2024Q1,Data Analysis,True
1539,2023-10-25,NLP Engineer,Kayrros,Paris,CDI,SaaS,Bac+3,"TensorFlow, Python, Spark, Scikit-learn",42494.0,Non,2,2023-10,2023Q4,Data Engineering,False
1540,2024-01-28,Stagiaire ML,Younited,Bordeaux,Stage,RetailTech,Bac+5,"dbt, Pandas, Scikit-learn, TensorFlow, Power BI, SQL",682.0,Hybride,0,2024-01,2024Q1,Stage,True
1541,2023-12-21,AI Researcher,Contentsquare,Paris,CDI,HealthTech,Bac+5,"SQL, dbt, Scikit-learn, Tableau, Azure",63714.0,Hybride,1,2023-12,2023Q4,Recherche IA,False
1543,2024-01-21,Data Scientist,Back Market,Paris,CDI,EdTech,Bac+5,"TensorFlow, Git, GCP",37113.0,Oui,0,2024-01,2024Q1,Data Science,False
1545,2023-08-18,Computer Vision Engineer,Payfit,Paris,Stage,HealthTech,Bac+4,"Hugging Face, Kubernetes, Docker, dbt, SQL",719.0,Non,2,2023-08,2023Q3,Data Engineering,True
1546,2023-12-08,NLP Engineer,Alan,Paris,Stage,MarTech,Bac+8 (PhD),"SQL, AWS, LLM, RAG, Computer Vision, Machine Learning, TensorFlow",670.0,Hybride,5,2023-12,2023Q4,Data Engineering,True
1547,2024-02-04,Computer Vision Engineer,Alan,Toulouse,CDI,EdTech,Bac+4,"TensorFlow, API REST, Pandas, Machine Learning, Hugging Face",66521.0,Non,0,2024-02,2024Q1,Data Engineering,False
1548,2023-12-08,Data Scientist,Ekimetrics,Paris,CDI,DeepTech,Bac+5,"Docker, Python, TensorFlow",62897.0,Hybride,0,2023-12,2023Q4,Data Science,False
1549,2024-06-05,NLP Engineer,Ekimetrics,Lille,Stage,FinTech,Bac+4,"Power BI, LLM, RAG, Airflow",1015.0,Oui,0,2024-06,2024Q2,Data Engineering,True
1550,2023-11-08,Data Scientist,PhotoRoom,Nantes,CDI,SaaS,Bac+3,"Git, NLP, Machine Learning, Spark, Scikit-learn",43372.0,Oui,0,2023-11,2023Q4,Data Science,False
1551,2024-01-08,Stagiaire Data Analyst,Back Market,Paris,Stage,E-commerce,Bac+5,"Kubernetes, Hugging Face, dbt, NLP, Airflow, RAG",1152.0,Hybride,1,2024-01,2024Q1,Data Analysis,True
1552,2023-09-17,Stagiaire Data Analyst,Payfit,Lille,CDI,EdTech,Bac+5,"Computer Vision, TensorFlow, AWS, GCP, RAG",45342.0,Hybride,0,2023-09,2023Q3,Data Analysis,False
1553,2024-06-16,Data Engineer,BlaBlaCar,Paris,CDI,E-commerce,Bac+4,"Power BI, NLP, Airflow",54861.0,Non,2,2024-06,2024Q2,Data Engineering,False
1554,2024-02-28,Stagiaire ML,Back Market,Paris,CDI,LegalTech,Bac+5,"SQL, RAG, Docker, Airflow, Deep Learning, TensorFlow",65914.0,Oui,0,2024-02,2024Q1,Stage,False
1555,2023-08-04,Computer Vision Engineer,Doctolib,Paris,CDI,DeepTech,Bac+4,"Deep Learning, GCP, LLM, Computer Vision",49934.0,Hybride,2,2023-08,2023Q3,Data Engineering,False
1556,2023-08-16,NLP Engineer,Owkin,Lyon,Stage,MarTech,Bac+5,"Kubernetes, Docker, Machine Learning, Spark, PyTorch, Hugging Face, NLP",714.0,Oui,2,2023-08,2023Q3,Data Engineering,True
1557,2023-08-13,NLP Engineer,Hugging Face,Lyon,CDI,EdTech,Bac+8 (PhD),"TensorFlow, Power BI, NLP, Python, Kubernetes, dbt",39855.0,Oui,2,2023-08,2023Q3,Data Engineering,False
1558,2023-08-17,Computer Vision Engineer,Younited,Paris,Stage,RetailTech,Bac+8 (PhD),"RAG, Pandas, Tableau, Power BI, Spark, Docker",947.0,Non,0,2023-08,2023Q3,Data Engineering,True
1559,2024-02-07,Stagiaire Data Science,Mistral AI,Paris,Stage,RetailTech,Bac+5,"RAG, Tableau, Machine Learning, Deep Learning, Git",827.0,Hybride,2,2024-02,2024Q1,Stage,True
1560,2023-08-19,Computer Vision Engineer,Dataiku,Lyon,Stage,FinTech,Bac+5,"GCP, Azure, TensorFlow",1120.0,Non,0,2023-08,2023Q3,Data Engineering,True
1561,2024-01-07,Data Scientist,Doctolib,Paris,Freelance,HealthTech,Bac+5,"Docker, dbt, AWS, GCP",618.0,Oui,0,2024-01,2024Q1,Data Science,False
1562,2023-09-05,AI Researcher,Mistral AI,Paris,Stage,LegalTech,Bac+5,"Deep Learning, SQL, RAG, Machine Learning, Hugging Face",700.0,Oui,2,2023-09,2023Q3,Recherche IA,True
1563,2024-04-10,Computer Vision Engineer,Mirakl,Paris,Stage,E-commerce,Bac+4,"Airflow, RAG, Docker",878.0,Oui,3,2024-04,2024Q2,Data Engineering,True
1564,2023-07-31,AI Researcher,PhotoRoom,Paris,CDI,E-commerce,Bac+5,"Machine Learning, Scikit-learn, Hugging Face, Airflow",69012.0,Oui,2,2023-07,2023Q3,Recherche IA,False
1565,2024-04-26,Stagiaire Data Science,BlaBlaCar,Lyon,Stage,RetailTech,Bac+4,"GCP, Docker, SQL, Tableau",1102.0,Hybride,2,2024-04,2024Q2,Stage,True
1566,2024-04-13,Computer Vision Engineer,Contentsquare,Nantes,CDI,LegalTech,Bac+8 (PhD),"Computer Vision, Docker, Azure, GCP, Tableau",41265.0,Non,5,2024-04,2024Q2,Data Engineering,False
1567,2024-04-13,Business Intelligence Analyst,Shift Technology,Paris,CDD,FinTech,Bac+3,"Spark, Scikit-learn, TensorFlow, GCP",74257.0,Oui,0,2024-04,2024Q2,Data Analysis,False
1568,2023-12-16,Stagiaire Data Science,Shift Technology,Lyon,CDI,RetailTech,Bac+8 (PhD),"TensorFlow, Deep Learning, Scikit-learn",49000.0,Hybride,0,2023-12,2023Q4,Stage,False
1569,2024-06-08,AI Researcher,Contentsquare,Paris,CDI,DeepTech,Bac+5,"GCP, Kubernetes, RAG, Spark, NLP",75680.0,Oui,5,2024-06,2024Q2,Recherche IA,False
1570,2023-09-01,Stagiaire Data Analyst,PhotoRoom,Paris,CDI,DeepTech,Bac+4,"Git, RAG, Docker, Pandas, NLP, SQL, dbt",68747.0,Oui,1,2023-09,2023Q3,Data Analysis,False
1571,2024-01-27,Data Analyst,PhotoRoom,Paris,CDD,SaaS,Bac+5,"SQL, Airflow, Tableau",65488.0,Non,5,2024-01,2024Q1,Data Analysis,False
1572,2023-12-29,NLP Engineer,Contentsquare,Paris,CDI,MarTech,Bac+5,"Scikit-learn, TensorFlow, Kubernetes, Git, GCP",69709.0,Hybride,5,2023-12,2023Q4,Data Engineering,False
1573,2024-06-05,ML Engineer,Owkin,Paris,Alternance,SaaS,Bac+5,"PyTorch, Airflow, Power BI",1114.0,Non,0,2024-06,2024Q2,ML Engineering,False
1574,2024-02-02,Data Scientist,Kayrros,Paris,Freelance,LegalTech,Bac+5,"Spark, Computer Vision, Hugging Face, NLP",747.0,Hybride,0,2024-02,2024Q1,Data Science,False
1575,2023-07-27,NLP Engineer,Doctolib,Paris,CDI,MarTech,Bac+4,"API REST, Python, Azure",63982.0,Hybride,1,2023-07,2023Q3,Data Engineering,False
1576,2023-11-25,Business Intelligence Analyst,Payfit,Paris,Stage,LegalTech,Bac+5,"Deep Learning, NLP, API REST",891.0,Oui,0,2023-11,2023Q4,Data Analysis,True
1577,2024-05-03,Business Intelligence Analyst,Contentsquare,Paris,CDI,FinTech,Bac+5,"Airflow, Computer Vision, Tableau, Git, RAG, Hugging Face, Pandas",50048.0,Non,5,2024-05,2024Q2,Data Analysis,False
1578,2023-12-07,Stagiaire Data Science,Contentsquare,Toulouse,CDI,HealthTech,Bac+5,"Docker, LLM, Scikit-learn, SQL, API REST, Kubernetes, Python",49471.0,Non,2,2023-12,2023Q4,Stage,False
1579,2023-12-28,Computer Vision Engineer,Withings,Paris,Stage,FinTech,Bac+8 (PhD),"RAG, Spark, Kubernetes, API REST, Git, Scikit-learn, Airflow",767.0,Oui,5,2023-12,2023Q4,Data Engineering,True
