id,date_publication,titre,entreprise,ville,type_contrat,secteur,niveau_requis,competences,salaire,teletravail,experience_requise_ans,mois,trimestre,categorie,est_stage
945,2023-08-13,MLOps Engineer,Mistral AI,Paris,CDD,DeepTech,Bac+5,"Computer Vision, API REST, TensorFlow",61281.0,Non,3,2023-08,2023Q3,ML Engineering,False
946,2023-11-05,Data Scientist,Owkin,Paris,CDI,LegalTech,Bac+5,"PyTorch, TensorFlow, AWS, Scikit-learn, Machine Learning",35432.0,Oui,5,2023-11,2023Q4,Data Science,False
947,2023-08-30,Stagiaire Data Analyst,Payfit,Paris,Stage,E-commerce,Bac+5,"API REST, GCP, PyTorch, Computer Vision",946.0,Non,2,2023-08,2023Q3,Data Analysis,True
948,2024-04-11,ML Engineer,Alan,Rennes,CDI,LegalTech,Bac+3,"Docker, dbt, Hugging Face, Power BI, SQL",43588.0,Oui,3,2024-04,2024Q2,ML Engineering,False
949,2024-01-30,Stagiaire Data Science,Qonto,Bordeaux,Stage,HealthTech,Bac+5,"TensorFlow, RAG, Azure",619.0,Oui,0,2024-01,2024Q1,Stage,True
950,2024-05-06,AI Researcher,PhotoRoom,Paris,CDI,HealthTech,Bac+5,"Machine Learning, NLP, Deep Learning, Scikit-learn, Kubernetes, PyTorch, Docker",61038.0,Non,3,2024-05,2024Q2,Recherche IA,False
951,2024-05-01,Business Intelligence Analyst,Kayrros,Lille,CDI,SaaS,Bac+8 (PhD),"Machine Learning, PyTorch, GCP, API REST, Scikit-learn",67750.0,Non,2,2024-05,2024Q2,Data Analysis,False
952,2024-05-12,Stagiaire Data Analyst,Doctolib,Marseille,CDI,EdTech,Bac+5,"Deep Learning, RAG, NLP, SQL",52249.0,Non,2,2024-05,2024Q2,Data Analysis,False
953,2023-10-24,Stagiaire Data Science,BlaBlaCar,Paris,CDI,MarTech,Bac+5,"Scikit-learn, dbt, Computer Vision, Hugging Face",62680.0,Oui,5,2023-10,2023Q4,Stage,False
954,2024-03-24,NLP Engineer,Back Market,Paris,CDI,FinTech,Bac+5,"Scikit-learn, Airflow, AWS, SQL, Hugging Face, GCP, Spark",45114.0,Oui,0,2024-03,2024Q1,Data Engineering,False
955,2024-01-11,AI Researcher,Swile,Toulouse,CDI,HealthTech,Bac+5,"PyTorch, RAG, Tableau, Machine Learning, Spark, GCP",83724.0,Non,2,2024-01,2024Q1,Recherche IA,False
956,2024-02-16,Computer Vision Engineer,Ekimetrics,Paris,CDI,DeepTech,Bac+4,"Scikit-learn, Deep Learning, Machine Learning, PyTorch, Git, Tableau, Power BI",67229.0,Non,0,2024-02,2024Q1,Data Engineering,False
957,2024-02-12,Business Intelligence Analyst,Qonto,Paris,CDI,HealthTech,Bac+5,"Hugging Face, NLP, Pandas, GCP, Git",53668.0,Non,2,2024-02,2024Q1,Data Analysis,False
958,2023-11-30,Data Scientist,Dataiku,Paris,CDD,DeepTech,Bac+5,"TensorFlow, NLP, API REST, Azure, Pandas, Kubernetes, RAG",50240.0,Oui,1,2023-11,2023Q4,Data Science,False
959,2024-04-27,NLP Engineer,Kayrros,Paris,CDD,RetailTech,Bac+4,"Pandas, SQL, API REST, Python, Power BI, Airflow",53365.0,Oui,0,2024-04,2024Q2,Data Engineering,False
960,2024-02-05,Data Analyst,Contentsquare,Paris,Freelance,E-commerce,Bac+5,"Tableau, Machine Learning, Docker, GCP, Scikit-learn",773.0,Oui,5,2024-02,2024Q1,Data Analysis,False
961,2023-12-04,AI Researcher,Withings,Paris,CDI,RetailTech,Bac+5,"SQL, Machine Learning, Power BI, Kubernetes",71646.0,Oui,1,2023-12,2023Q4,Recherche IA,False
962,2024-04-17,NLP Engineer,ManoMano,Lyon,CDI,DeepTech,Bac+5,"NLP, LLM, GCP, PyTorch, Power BI, dbt",73846.0,Oui,3,2024-04,2024Q2,Data Engineering,False
963,2024-05-13,Stagiaire Data Science,Mirakl,Paris,Stage,RetailTech,Bac+4,"Machine Learning, Git, AWS, RAG",851.0,Non,5,2024-05,2024Q2,Stage,True
964,2023-07-31,Stagiaire ML,Hugging Face,Lille,Stage,DeepTech,Bac+3,"Python, TensorFlow, Scikit-learn, NLP, Kubernetes",997.0,Non,3,2023-07,2023Q3,Stage,True
965,2024-05-08,Stagiaire ML,Swile,Paris,CDI,HealthTech,Bac+5,"Scikit-learn, TensorFlow, Azure",51128.0,Oui,0,2024-05,2024Q2,Stage,False
966,2023-08-20,Stagiaire ML,PhotoRoom,Paris,Stage,DeepTech,Bac+4,"Power BI, GCP, LLM, API REST",824.0,Oui,1,2023-08,2023Q3,Stage,True
967,2023-10-15,Data Engineer,Doctolib,Paris,CDI,FinTech,Bac+5,"AWS, RAG, Python, dbt",51527.0,Non,1,2023-10,2023Q4,Data Engineering,False
968,2024-05-16,MLOps Engineer,Swile,Paris,Stage,DeepTech,Bac+4,"GCP, NLP, Azure",837.0,Non,1,2024-05,2024Q2,ML Engineering,True
969,2023-10-17,Business Intelligence Analyst,Doctolib,Toulouse,CDI,RetailTech,Bac+5,"Power BI, Computer Vision, Kubernetes, Deep Learning, PyTorch, Scikit-learn, API REST",36677.0,Hybride,3,2023-10,2023Q4,Data Analysis,False
970,2023-11-13,ML Engineer,Owkin,Nantes,CDI,HealthTech,Bac+4,"Power BI, Tableau, Docker, AWS, API REST, GCP, Deep Learning",57282.0,Oui,5,2023-11,2023Q4,ML Engineering,False
971,2024-06-03,Data Scientist,Payfit,Bordeaux,CDI,FinTech,Bac+4,"Power BI, Deep Learning, NLP, Hugging Face, LLM, Git, Scikit-learn",73325.0,Hybride,1,2024-06,2024Q2,Data Science,False
972,2023-08-11,NLP Engineer,Alan,Lille,CDD,HealthTech,Bac+5,"Spark, API REST, Scikit-learn, LLM",71657.0,Oui,2,2023-08,2023Q3,Data Engineering,False
973,2023-09-19,Data Analyst,Alan,Paris,Stage,FinTech,Bac+5,"Scikit-learn, Power BI, Azure, GCP, Git",1051.0,Non,0,2023-09,2023Q3,Data Analysis,True
974,2023-10-31,MLOps Engineer,Mistral AI,Paris,Stage,DeepTech,Bac+5,"Airflow, AWS, Docker, Power BI, Spark",1039.0,Oui,0,2023-10,2023Q4,ML Engineering,True
975,2023-09-27,Data Scientist,BlaBlaCar,Toulouse,CDI,MarTech,Bac+5,"dbt, Computer Vision, Git, Hugging Face",56612.0,Oui,3,2023-09,2023Q3,Data Science,False
976,2024-04-08,NLP Engineer,Alan,Paris,CDI,FinTech,Bac+4,"LLM, Tableau, Pandas, Hugging Face",71602.0,Hybride,2,2024-04,2024Q2,Data Engineering,False
977,2023-08-08,ML Engineer,Contentsquare,Paris,CDD,LegalTech,Bac+4,"Git, PyTorch, Tableau, Kubernetes, Computer Vision, API REST",55564.0,Oui,5,2023-08,2023Q3,ML Engineering,False
978,2023-09-19,ML Engineer,PhotoRoom,Paris,Stage,MarTech,Bac+4,"Deep Learning, Azure, RAG, Tableau, Git, Airflow, LLM",624.0,Oui,0,2023-09,2023Q3,ML Engineering,True
979,2023-07-02,Data Analyst,ManoMano,Marseille,CDI,RetailTech,Bac+5,"Power BI, Python, Azure",73630.0,Oui,3,2023-07,2023Q3,Data Analysis,False
980,2024-01-26,Stagiaire ML,PhotoRoom,Paris,Stage,LegalTech,Bac+5,"Machine Learning, RAG, Tableau, Python, TensorFlow, Scikit-learn, dbt",1003.0,Hybride,0,2024-01,2024Q1,Stage,True
981,2024-02-16,AI Researcher,Alan,Paris,Freelance,EdTech,Bac+4,"LLM, Spark, Git, API REST",82415.0,Hybride,0,2024-02,2024Q1,Recherche IA,False
982,2024-06-17,AI Researcher,ManoMano,Paris,Alternance,HealthTech,Bac+5,"TensorFlow, Azure, Python",1483.0,Oui,2,2024-06,2024Q2,Recherche IA,False
983,2024-04-30,Stagiaire Data Science,Kayrros,Paris,Stage,RetailTech,Bac+4,"Deep Learning, TensorFlow, Docker",1163.0,Oui,0,2024-04,2024Q2,Stage,True
984,2024-02-26,Computer Vision Engineer,Contentsquare,Paris,Stage,HealthTech,Bac+5,"Pandas, Tableau, Deep Learning, NLP, Python",784.0,Non,5,2024-02,2024Q1,Data Engineering,True
985,2023-11-27,Data Analyst,Swile,Paris,CDI,RetailTech,Bac+5,"AWS, Power BI, Tableau, Kubernetes",41837.0,Oui,1,2023-11,2023Q4,Data Analysis,False
986,2023-07-17,Data Scientist,Dataiku,Grenoble,Stage,HealthTech,Bac+5,"AWS, RAG, Azure, Hugging Face",650.0,Non,1,2023-07,2023Q3,Data Science,True
987,2023-10-27,Computer Vision Engineer,Ekimetrics,Paris,CDI,FinTech,Bac+5,"Hugging Face, LLM, Python, PyTorch, Computer Vision, Airflow, Deep Learning",61469.0,Hybride,0,2023-10,2023Q4,Data Engineering,False
988,2023-11-25,MLOps Engineer,BlaBlaCar,Paris,CDI,RetailTech,Bac+5,"API REST, TensorFlow, Pandas, dbt, Deep Learning, GCP, Python",35948.0,Oui,0,2023-11,2023Q4,ML Engineering,False
989,2024-06-26,Stagiaire ML,Doctolib,Paris,Alternance,E-commerce,Bac+5,"Airflow, NLP, Pandas, Machine Learning",1185.0,Hybride,1,2024-06,2024Q2,Stage,False
990,2023-11-22,Computer Vision Engineer,Ekimetrics,Paris,Freelance,EdTech,Bac+3,"Power BI, Computer Vision, Tableau, Pandas, Airflow, PyTorch",420.0,Non,0,2023-11,2023Q4,Data Engineering,False
991,2024-06-24,Stagiaire Data Science,Mirakl,Paris,Stage,EdTech,Bac+5,"Docker, PyTorch, Pandas, NLP, Power BI, Scikit-learn, Azure",617.0,Non,3,2024-06,2024Q2,Stage,True
992,2024-02-18,Data Analyst,Swile,Toulouse,CDI,RetailTech,Bac+3,"Tableau, Power BI, Pandas, RAG, dbt, Azure, Machine Learning",47257.0,Oui,3,2024-02,2024Q1,Data Analysis,False
993,2023-08-06,AI Researcher,Mistral AI,Paris,Stage,HealthTech,Bac+5,"Power BI, Docker, Hugging Face, Azure, Computer Vision, dbt, Tableau",1184.0,Oui,1,2023-08,2023Q3,Recherche IA,True
994,2024-06-16,NLP Engineer,Doctolib,Lyon,CDI,MarTech,Bac+8 (PhD),"dbt, Spark, Machine Learning, Pandas",45860.0,Oui,1,2024-06,2024Q2,Data Engineering,False
995,2023-10-28,Data Analyst,BlaBlaCar,Paris,CDI,LegalTech,Bac+5,"Kubernetes, GCP, Python",37023.0,Non,3,2023-10,2023Q4,Data Analysis,False
996,2023-11-13,Business Intelligence Analyst,Mirakl,Toulouse,CDD,LegalTech,Bac+4,"LLM, Machine Learning, Tableau, Docker",43973.0,Hybride,0,2023-11,2023Q4,Data Analysis,False
997,2024-05-16,Data Analyst,Contentsquare,Lille,Stage,MarTech,Bac+5,"Airflow, GCP, Hugging Face, AWS, Machine Learning, RAG, Power BI",657.0,Non,0,2024-05,2024Q2,Data Analysis,True
998,2024-04-27,Data Engineer,Contentsquare,Nantes,CDI,HealthTech,Bac+4,"NLP, SQL, Airflow",38341.0,Oui,2,2024-04,2024Q2,Data Engineering,False
999,2024-06-03,ML Engineer,Mistral AI,Paris,Stage,FinTech,Bac+5,"Kubernetes, RAG, Tableau, Spark, Git, Python, Docker",896.0,Non,1,2024-06,2024Q2,ML Engineering,True
1000,2023-10-10,ML Engineer,Owkin,Paris,CDI,SaaS,Bac+4,"SQL, LLM, Computer Vision, API REST, Kubernetes, Python",56198.0,Oui,2,2023-10,2023Q4,ML Engineering,False
1001,2024-02-03,Stagiaire ML,Owkin,Toulouse,Stage,E-commerce,Bac+4,"Airflow, Kubernetes, API REST, dbt, Tableau",1056.0,Non,2,2024-02,2024Q1,Stage,True
1002,2023-08-28,Stagiaire Data Science,Swile,Paris,CDI,SaaS,Bac+5,"Tableau, Docker, GCP",49443.0,Hybride,0,2023-08,2023Q3,Stage,False
1003,2024-04-04,Business Intelligence Analyst,BlaBlaCar,Paris,Stage,DeepTech,Bac+5,"Deep Learning, Python, Spark, SQL, Git, TensorFlow, API REST",621.0,Oui,0,2024-04,2024Q2,Data Analysis,True
1004,2023-10-24,Data Analyst,Dataiku,Paris,Stage,EdTech,Bac+4,"Git, dbt, LLM, Python",985.0,Oui,0,2023-10,2023Q4,Data Analysis,True
1005,2024-05-27,Data Scientist,Alan,Grenoble,CDD,EdTech,Bac+4,"Machine Learning, Airflow, Kubernetes, GCP, Hugging Face",46891.0,Hybride,0,2024-05,2024Q2,Data Science,False
1006,2023-09-15,ML Engineer,Swile,Paris,CDI,HealthTech,Bac+5,"Scikit-learn, Deep Learning, TensorFlow, Kubernetes, GCP, RAG, Power BI",61895.0,Hybride,3,2023-09,2023Q3,ML Engineering,False
1007,2023-11-14,Data Engineer,Owkin,Toulouse,Stage,EdTech,Bac+4,"NLP, AWS, API REST, Airflow, Kubernetes, GCP, Spark",838.0,Non,5,2023-11,2023Q4,Data Engineering,True
1008,2023-09-11,Data Analyst,Ekimetrics,Paris,Stage,HealthTech,Bac+4,"LLM, Spark, AWS, Azure, Git",1003.0,Oui,2,2023-09,2023Q3,Data Analysis,True
1009,2023-08-06,Data Scientist,Alan,Strasbourg,CDI,LegalTech,Bac+8 (PhD),"Python, AWS, Pandas, Scikit-learn",41248.0,Non,0,2023-08,2023Q3,Data Science,False
1010,2023-07-31,Business Intelligence Analyst,Withings,Toulouse,Alternance,SaaS,Bac+5,"RAG, API REST, Computer Vision, Kubernetes",1528.0,Hybride,0,2023-07,2023Q3,Data Analysis,False
1011,2023-09-23,MLOps Engineer,Alan,Paris,CDD,SaaS,Bac+5,"TensorFlow, Spark, dbt",53707.0,Hybride,3,2023-09,2023Q3,ML Engineering,False
1012,2023-12-05,Data Engineer,ManoMano,Paris,CDI,HealthTech,Bac+5,"Pandas, Machine Learning, Airflow, Power BI, PyTorch, Docker",48211.0,Oui,2,2023-12,2023Q4,Data Engineering,False
1013,2024-04-30,Data Analyst,PhotoRoom,Paris,CDD,EdTech,Bac+5,"Spark, Python, Scikit-learn",72377.0,Oui,2,2024-04,2024Q2,Data Analysis,False
1014,2024-04-17,Stagiaire Data Analyst,Contentsquare,Paris,CDD,LegalTech,Bac+3,"Scikit-learn, dbt, Airflow, Deep Learning, LLM, Machine Learning, Git",66181.0,Oui,2,2024-04,2024Q2,Data Analysis,False
1015,2023-11-25,MLOps Engineer,Hugging Face,Paris,Stage,FinTech,Bac+8 (PhD),"Computer Vision, Kubernetes, SQL, Scikit-learn, Airflow, dbt",1134.0,Hybride,2,2023-11,2023Q4,ML Engineering,True
1016,2024-02-10,Stagiaire ML,Kayrros,Paris,CDI,E-commerce,Bac+4,"Pandas, Docker, API REST, Tableau, PyTorch, Hugging Face",65615.0,Hybride,2,2024-02,2024Q1,Stage,False
1017,2023-09-02,MLOps Engineer,Younited,Paris,CDD,HealthTech,Bac+8 (PhD),"Deep Learning, AWS, SQL, Azure, Spark, API REST",40038.0,Oui,0,2023-09,2023Q3,ML Engineering,False
1018,2024-02-25,Stagiaire Data Science,Younited,Nantes,Stage,DeepTech,Bac+5,"Spark, Machine Learning, LLM, Deep Learning, Airflow",795.0,Non,2,2024-02,2024Q1,Stage,True
1019,2024-06-17,Data Analyst,Ekimetrics,Paris,Stage,RetailTech,Bac+5,"Git, GCP, Airflow, NLP",1010.0,Oui,1,2024-06,2024Q2,Data Analysis,True
1020,2023-12-03,Stagiaire Data Analyst,Hugging Face,Paris,CDI,RetailTech,Bac+4,"GCP, Hugging Face, Docker, Git, Python",65743.0,Hybride,5,2023-12,2023Q4,Data Analysis,False
1021,2024-06-23,Stagiaire Data Science,Owkin,Paris,Stage,RetailTech,Bac+5,"Git, Docker, GCP, Spark, PyTorch, Kubernetes",975.0,Oui,1,2024-06,2024Q2,Stage,True
1022,2024-01-23,Computer Vision Engineer,BlaBlaCar,Paris,CDI,FinTech,Bac+5,"Python, AWS, NLP, Power BI",40239.0,Oui,1,2024-01,2024Q1,Data Engineering,False
1023,2023-11-17,Data Analyst,Doctolib,Paris,CDD,SaaS,Bac+5,"AWS, API REST, Python, Hugging Face",64366.0,Hybride,0,2023-11,2023Q4,Data Analysis,False
1024,2024-03-13,Computer Vision Engineer,ManoMano,Grenoble,CDI,EdTech,Bac+5,"NLP, Deep Learning, SQL, Python",48279.0,Oui,3,2024-03,2024Q1,Data Engineering,False
1026,2024-03-09,Business Intelligence Analyst,Doctolib,Paris,Stage,EdTech,Bac+4,"Airflow, AWS, NLP, API REST, dbt, Scikit-learn, Python",929.0,Hybride,1,2024-03,2024Q1,Data Analysis,True
1027,2024-02-10,MLOps Engineer,Contentsquare,Lyon,CDI,LegalTech,Bac+3,"NLP, Deep Learning, Airflow, AWS, Computer Vision, Python, TensorFlow",73612.0,Hybride,0,2024-02,2024Q1,ML Engineering,False
1028,2023-08-11,Business Intelligence Analyst,Owkin,Paris,CDD,LegalTech,Bac+5,"Python, Spark, RAG, Power BI, dbt, Pandas",57557.0,Non,5,2023-08,2023Q3,Data Analysis,False
1029,2024-05-02,Data Analyst,PhotoRoom,Paris,CDI,EdTech,Bac+5,"Azure, AWS, LLM, Scikit-learn, Computer Vision",59036.0,Hybride,1,2024-05,2024Q2,Data Analysis,False
1030,2023-07-21,Business Intelligence Analyst,ManoMano,Paris,Freelance,E-commerce,Bac+5,"RAG, Power BI, Airflow, Docker, Pandas, SQL",457.0,Hybride,1,2023-07,2023Q3,Data Analysis,False
1031,2024-02-07,Stagiaire Data Science,Doctolib,Paris,CDI,EdTech,Bac+8 (PhD),"Power BI, Scikit-learn, RAG",62913.0,Oui,0,2024-02,2024Q1,Stage,False
1032,2023-12-13,Computer Vision Engineer,Withings,Lyon,Stage,E-commerce,Bac+8 (PhD),"Scikit-learn, AWS, TensorFlow, Computer Vision",1008.0,Hybride,0,2023-12,2023Q4,Data Engineering,True
1033,2024-05-05,AI Researcher,Ekimetrics,Paris,CDI,EdTech,Bac+4,"Docker, Machine Learning, API REST, Python, Scikit-learn, SQL",64518.0,Hybride,0,2024-05,2024Q2,Recherche IA,False
1034,2023-11-06,Data Scientist,Kayrros,Lyon,Stage,RetailTech,Bac+3,"Docker, Python, Power BI, dbt, Git, SQL",956.0,Non,1,2023-11,2023Q4,Data Science,True
1035,2023-07-14,MLOps Engineer,ManoMano,Paris,Stage,HealthTech,Bac+5,"TensorFlow, Machine Learning, GCP, Airflow, API REST, Pandas, Power BI",999.0,Non,0,2023-07,2023Q3,ML Engineering,True
1036,2023-08-16,Data Scientist,Alan,Paris,CDI,HealthTech,Bac+5,"dbt, Spark, AWS, Azure, Tableau, Power BI",38777.0,Non,1,2023-08,2023Q3,Data Science,False
1037,2023-10-26,Stagiaire Data Science,ManoMano,Lyon,Freelance,RetailTech,Bac+5,"PyTorch, RAG, Power BI, AWS, Kubernetes",441.0,Hybride,0,2023-10,2023Q4,Stage,False
1038,2024-06-10,AI Researcher,Withings,Bordeaux,Stage,HealthTech,Bac+3,"Power BI, LLM, Pandas, Docker",671.0,Non,3,2024-06,2024Q2,Recherche IA,True
1039,2024-04-20,Stagiaire Data Analyst,Payfit,Paris,Stage,SaaS,Bac+3,"LLM, PyTorch, Tableau, Power BI, Deep Learning, TensorFlow",753.0,Hybride,1,2024-04,2024Q2,Data Analysis,True
1040,2024-04-26,MLOps Engineer,Mistral AI,Nantes,Stage,DeepTech,Bac+5,"Scikit-learn, dbt, Power BI, Python, LLM",1175.0,Oui,0,2024-04,2024Q2,ML Engineering,True
1041,2023-07-11,Stagiaire Data Science,Mirakl,Paris,CDI,E-commerce,Bac+5,"Spark, RAG, Computer Vision, dbt, TensorFlow",56955.0,Hybride,1,2023-07,2023Q3,Stage,False
1042,2024-06-09,Data Scientist,Swile,Paris,Stage,FinTech,Bac+3,"TensorFlow, Tableau, AWS, Python, Scikit-learn, Computer Vision",744.0,Oui,0,2024-06,2024Q2,Data Science,True
1043,2023-11-15,AI Researcher,Withings,Paris,CDI,SaaS,Bac+8 (PhD),"Kubernetes, Hugging Face, Deep Learning",61191.0,Hybride,1,2023-11,2023Q4,Recherche IA,False
1044,2024-04-21,Data Scientist,Payfit,Paris,CDI,FinTech,Bac+8 (PhD),"Git, RAG, AWS",69945.0,Hybride,0,2024-04,2024Q2,Data Science,False
1045,2023-07-21,MLOps Engineer,Younited,Toulouse,Stage,RetailTech,Bac+4,"LLM, Git, NLP, TensorFlow",796.0,Non,5,2023-07,2023Q3,ML Engineering,True
1046,2023-09-28,AI Researcher,Ekimetrics,Lyon,CDI,HealthTech,Bac+4,"NLP, Hugging Face, GCP",78877.0,Oui,0,2023-09,2023Q3,Recherche IA,False
1047,2024-02-26,ML Engineer,Mistral AI,Lyon,CDI,E-commerce,Bac+5,"Deep Learning, Computer Vision, API REST, Spark, Pandas, GCP, NLP",40133.0,Non,2,2024-02,2024Q1,ML Engineering,False
1048,2024-03-22,Data Scientist,PhotoRoom,Lyon,Stage,LegalTech,Bac+5,"Docker, Tableau, NLP",1052.0,Hybride,1,2024-03,2024Q1,Data Science,True
1049,2024-05-29,Stagiaire Data Science,PhotoRoom,Bordeaux,CDI,RetailTech,Bac+4,"AWS, Hugging Face, Deep Learning, Power BI, TensorFlow, Python",59767.0,Hybride,5,2024-05,2024Q2,Stage,False
1050,2024-02-12,Data Engineer,Ekimetrics,Paris,CDI,SaaS,Bac+5,"Computer Vision, Git, GCP, LLM",52721.0,Non,1,2024-02,2024Q1,Data Engineering,False
1051,2023-11-20,AI Researcher,Kayrros,Paris,CDD,DeepTech,Bac+8 (PhD),"RAG, NLP, dbt",59394.0,Non,5,2023-11,2023Q4,Recherche IA,False
1052,2023-10-01,Data Analyst,Hugging Face,Paris,CDI,DeepTech,Bac+5,"Power BI, API REST, TensorFlow, Python, Docker, Scikit-learn",58423.0,Oui,3,2023-10,2023Q4,Data Analysis,False
1053,2024-04-25,AI Researcher,Swile,Paris,CDI,FinTech,Bac+5,"Azure, AWS, Hugging Face",58692.0,Non,0,2024-04,2024Q2,Recherche IA,False
1054,2024-02-09,Computer Vision Engineer,Ekimetrics,Paris,Stage,MarTech,Bac+5,"Airflow, Python, PyTorch, dbt, Computer Vision, Azure",983.0,Hybride,3,2024-02,2024Q1,Data Engineering,True
1055,2024-05-21,NLP Engineer,Swile,Paris,CDI,RetailTech,Bac+4,"Machine Learning, PyTorch, Azure, TensorFlow, dbt, RAG, Kubernetes",62572.0,Non,5,2024-05,2024Q2,Data Engineering,False
1056,2024-03-08,AI Researcher,PhotoRoom,Paris,CDI,E-commerce,Bac+5,"Machine Learning, Azure, NLP, Tableau, GCP, Hugging Face",86428.0,Hybride,3,2024-03,2024Q1,Recherche IA,False
1057,2023-08-16,AI Researcher,ManoMano,Bordeaux,Stage,DeepTech,Bac+5,"GCP, Kubernetes, RAG, dbt",819.0,Oui,0,2023-08,2023Q3,Recherche IA,True
1058,2024-02-26,Data Scientist,Qonto,Paris,CDI,MarTech,Bac+5,"Spark, Deep Learning, AWS, NLP",63070.0,Oui,5,2024-02,2024Q1,Data Science,False
1059,2023-12-26,Data Engineer,Contentsquare,Grenoble,CDI,HealthTech,Bac+4,"PyTorch, Git, Tableau",35837.0,Oui,3,2023-12,2023Q4,Data Engineering,False
1060,2024-01-26,AI Researcher,Swile,Bordeaux,CDI,MarTech,Bac+5,"SQL, Git, Machine Learning",79574.0,Hybride,5,2024-01,2024Q1,Recherche IA,False
1061,2023-12-18,Data Scientist,Alan,Paris,Stage,RetailTech,Bac+5,"Kubernetes, Deep Learning, GCP, Scikit-learn",1054.0,Hybride,3,2023-12,2023Q4,Data Science,True
1062,2023-12-12,MLOps Engineer,Withings,Lille,CDI,LegalTech,Bac+4,"Pandas, Airflow, NLP, Scikit-learn",45035.0,Oui,5,2023-12,2023Q4,ML Engineering,False
1063,2024-06-08,ML Engineer,Ekimetrics,Marseille,Stage,FinTech,Bac+3,"Computer Vision, Pandas, Machine Learning, RAG, Python, Deep Learning",827.0,Oui,0,2024-06,2024Q2,ML Engineering,True
1064,2023-08-23,Business Intelligence Analyst,Qonto,Paris,CDI,LegalTech,Bac+5,"RAG, LLM, Machine Learning, Kubernetes, PyTorch, Computer Vision",41477.0,Oui,3,2023-08,2023Q3,Data Analysis,False
1065,2023-09-21,Computer Vision Engineer,Contentsquare,Paris,Alternance,DeepTech,Bac+5,"dbt, API REST, Hugging Face, LLM, TensorFlow, Machine Learning, Scikit-learn",1284.0,Oui,3,2023-09,2023Q3,Data Engineering,False
1066,2023-12-16,Data Analyst,Younited,Nantes,CDI,FinTech,Bac+5,"Computer Vision, Docker, Deep Learning, NLP",51593.0,Hybride,3,2023-12,2023Q4,Data Analysis,False
1067,2024-01-27,Business Intelligence Analyst,Alan,Paris,Stage,MarTech,Bac+3,"Spark, Docker, Airflow",989.0,Oui,0,2024-01,2024Q1,Data Analysis,True
1068,2024-06-20,AI Researcher,Payfit,Lille,Stage,E-commerce,Bac+8 (PhD),"LLM, RAG, Spark",989.0,Non,2,2024-06,2024Q2,Recherche IA,True
1070,2023-11-25,Data Scientist,Ekimetrics,Paris,CDI,MarTech,Bac+5,"Kubernetes, Power BI, Airflow",40073.0,Oui,0,2023-11,2023Q4,Data Science,False
1071,2024-06-04,Data Engineer,ManoMano,Bordeaux,CDI,FinTech,Bac+3,"Git, Kubernetes, AWS, SQL, Spark, NLP, Machine Learning",43353.0,Non,0,2024-06,2024Q2,Data Engineering,False
1072,2024-01-22,NLP Engineer,Dataiku,Paris,Stage,HealthTech,Bac+5,"Git, Hugging Face, Machine Learning, LLM, NLP, TensorFlow, Airflow",1123.0,Oui,2,2024-01,2024Q1,Data Engineering,True
1073,2024-04-07,MLOps Engineer,Withings,Toulouse,CDI,LegalTech,Bac+3,"Azure, dbt, Power BI, NLP",56611.0,Oui,0,2024-04,2024Q2,ML Engineering,False
1074,2023-07-19,Data Scientist,Mistral AI,Grenoble,Stage,E-commerce,Bac+4,"LLM, Hugging Face, Tableau, AWS",838.0,Non,0,2023-07,2023Q3,Data Science,True
1075,2024-02-18,NLP Engineer,Hugging Face,Paris,CDI,SaaS,Bac+5,"GCP, TensorFlow, Power BI, API REST, LLM, Git",52311.0,Oui,3,2024-02,2024Q1,Data Engineering,False
1076,2023-08-15,Business Intelligence Analyst,Younited,Lille,CDI,HealthTech,Bac+5,"Pandas, Kubernetes, Power BI, SQL, Spark",65205.0,Hybride,0,2023-08,2023Q3,Data Analysis,False
1077,2023-12-09,Data Engineer,Dataiku,Paris,CDD,HealthTech,Bac+5,"Git, LLM, RAG, SQL, Python, Spark",54074.0,Oui,0,2023-12,2023Q4,Data Engineering,False
1078,2023-11-07,Computer Vision Engineer,Mirakl,Toulouse,CDD,LegalTech,Bac+8 (PhD),"Docker, SQL, Kubernetes, dbt",46083.0,Non,0,2023-11,2023Q4,Data Engineering,False
1079,2023-12-13,Stagiaire Data Science,Kayrros,Nantes,CDI,E-commerce,Bac+4,"NLP, AWS, Deep Learning, Git, Machine Learning, Azure",73838.0,Oui,2,2023-12,2023Q4,Stage,False
1080,2023-08-29,Stagiaire ML,Back Market,Paris,Stage,EdTech,Bac+5,"Spark, Scikit-learn, GCP, Docker, dbt",843.0,Hybride,0,2023-08,2023Q3,Stage,True
1081,2024-01-23,MLOps Engineer,Dataiku,Lille,Stage,MarTech,Bac+5,"Kubernetes, GCP, LLM, Computer Vision, Deep Learning",1003.0,Non,5,2024-01,2024Q1,ML Engineering,True
1082,2024-03-20,Stagiaire Data Science,Withings,Lille,Stage,E-commerce,Bac+8 (PhD),"Airflow, Machine Learning, Pandas, TensorFlow, Computer Vision, Spark",613.0,Oui,0,2024-03,2024Q1,Stage,True
1083,2023-07-01,Business Intelligence Analyst,Swile,Toulouse,CDI,HealthTech,Bac+4,"SQL, Spark, GCP, Scikit-learn",46213.0,Oui,2,2023-07,2023Q3,Data Analysis,False
1084,2024-06-01,Data Scientist,Dataiku,Lyon,CDI,EdTech,Bac+3,"Airflow, RAG, Tableau, Docker, Machine Learning",50238.0,Hybride,2,2024-06,2024Q2,Data Science,False
1085,2024-04-03,Computer Vision Engineer,Younited,Grenoble,Stage,LegalTech,Bac+4,"Tableau, Scikit-learn, SQL",830.0,Non,0,2024-04,2024Q2,Data Engineering,True
1086,2024-02-22,Stagiaire Data Analyst,Doctolib,Paris,CDI,FinTech,Bac+5,"LLM, SQL, AWS, Docker, Git, API REST",67820.0,Hybride,1,2024-02,2024Q1,Data Analysis,False
1087,2024-01-28,AI Researcher,Hugging Face,Paris,Stage,E-commerce,Bac+5,"Pandas, Python, Kubernetes, Hugging Face, Power BI, Azure, SQL",1080.0,Non,5,2024-01,2024Q1,Recherche IA,True
1088,2023-07-28,Stagiaire Data Analyst,ManoMano,Lyon,CDD,E-commerce,Bac+5,"LLM, Scikit-learn, Power BI, RAG, Git",66376.0,Non,0,2023-07,2023Q3,Data Analysis,False
1089,2023-10-05,NLP Engineer,Owkin,Lille,CDI,LegalTech,Bac+5,"Git, Spark, TensorFlow, Python, Airflow, Azure",56645.0,Hybride,1,2023-10,2023Q4,Data Engineering,False
1090,2024-03-22,Business Intelligence Analyst,Mirakl,Lyon,CDI,FinTech,Bac+4,"Tableau, SQL, Hugging Face, Airflow, dbt, AWS, GCP",57864.0,Oui,1,2024-03,2024Q1,Data Analysis,False
1091,2024-01-02,Stagiaire Data Science,Doctolib,Paris,CDI,SaaS,Bac+5,"Airflow, PyTorch, Scikit-learn, Python, SQL",65548.0,Hybride,3,2024-01,2024Q1,Stage,False
1092,2024-05-14,Data Engineer,BlaBlaCar,Lyon,CDI,HealthTech,Bac+5,"SQL, RAG, Machine Learning, Airflow, Hugging Face, LLM",38204.0,Non,0,2024-05,2024Q2,Data Engineering,False
1093,2024-03-12,AI Researcher,PhotoRoom,Paris,CDI,RetailTech,Bac+5,"Airflow, NLP, TensorFlow, Spark, Azure",62080.0,Hybride,5,2024-03,2024Q1,Recherche IA,False
1094,2024-05-16,Data Scientist,Payfit,Paris,CDI,SaaS,Bac+5,"Deep Learning, Azure, SQL, PyTorch",55468.0,Hybride,1,2024-05,2024Q2,Data Science,False
1095,2024-02-12,Data Scientist,Back Market,Toulouse,CDI,FinTech,Bac+5,"GCP, Spark, SQL, Airflow, AWS, Python, dbt",40813.0,Hybride,0,2024-02,2024Q1,Data Science,False
1096,2023-07-27,Business Intelligence Analyst,Hugging Face,Paris,CDI,E-commerce,Bac+5,"Machine Learning, Computer Vision, Scikit-learn",57955.0,Oui,0,2023-07,2023Q3,Data Analysis,False
1097,2023-10-13,Data Engineer,Contentsquare,Paris,CDD,EdTech,Bac+3,"RAG, dbt, AWS, Power BI, Machine Learning",73392.0,Oui,0,2023-10,2023Q4,Data Engineering,False
1098,2023-11-14,Business Intelligence Analyst,Mirakl,Paris,CDI,FinTech,Bac+5,"dbt, Kubernetes, Power BI, Azure, API REST, NLP, Docker",42411.0,Oui,1,2023-11,2023Q4,Data Analysis,False
1099,2024-04-07,Data Scientist,Ekimetrics,Paris,Stage,MarTech,Bac+5,"TensorFlow, RAG, Python, Deep Learning, Hugging Face",1168.0,Hybride,5,2024-04,2024Q2,Data Science,True
1100,2023-09-06,Stagiaire ML,Shift Technology,Paris,CDI,DeepTech,Bac+4,"RAG, GCP, dbt, Pandas, Tableau, API REST, SQL",41795.0,Hybride,0,2023-09,2023Q3,Stage,False
1101,2023-11-25,Data Analyst,Contentsquare,Paris,CDI,E-commerce,Bac+5,"RAG, Computer Vision, Azure, LLM",44834.0,Hybride,0,2023-11,2023Q4,Data Analysis,False
1102,2024-02-10,MLOps Engineer,Payfit,Lyon,Alternance,E-commerce,Bac+4,"Hugging Face, NLP, AWS",1759.0,Non,1,2024-02,2024Q1,ML Engineering,False
1103,2024-06-22,AI Researcher,Younited,Paris,CDI,MarTech,Bac+3,"RAG, Docker, Spark, Kubernetes",57687.0,Oui,2,2024-06,2024Q2,Recherche IA,False
